{
  "$schema": "./platform-manifest.schema.json",
  "schemaVersion": 1,
  "assetVersion": "2",
  "infrastructure": {
    "localGateway": {
      "port": 8080,
      "portParameter": "GatewayPort",
      "rootSiteId": "xjk"
    },
    "localhostBrowserProxy": {
      "port": 8877,
      "managedByStackReset": false
    },
    "security": {
      "localOnlyOverrides": [
        {
          "serviceId": "aggregator-hub",
          "environmentVariable": "AGGREGATOR_ALLOW_INSECURE_OPEN",
          "localValue": "1",
          "allowedInProduction": false
        },
        {
          "serviceId": "bannerbuilder",
          "environmentVariable": "BANNERBUILDER_ALLOW_EPHEMERAL_SECRET",
          "localValue": "1",
          "allowedInProduction": false
        },
        {
          "serviceId": "bannerbuilder",
          "environmentVariable": "BANNERBUILDER_COOKIE_SECURE",
          "localValue": "0",
          "allowedInProduction": false
        }
      ]
    }
  },
  "routing": {
    "tools": {
      "siteId": "tools",
      "rootServiceId": "tools-hub"
    },
    "tracker": {
      "siteId": "trackers",
      "rootServiceId": "tracker-hub",
      "modes": [
        { "path": "wr", "serviceId": "tracker-hub" },
        { "path": "leaderboard", "serviceId": "tracker-leaderboard-hub" },
        { "path": "displayname", "serviceId": "tracker-displayname-hub" },
        { "path": "club", "serviceId": "tracker-club-hub" }
      ]
    }
  },
  "sites": [
    {
      "id": "xjk",
      "name": "Main",
      "host": "xjk.yt",
      "aliases": ["www.xjk.yt"],
      "frontend": "sites/xjk.yt/frontend",
      "visibility": "public"
    },
    {
      "id": "account",
      "name": "Account",
      "host": "account.xjk.yt",
      "aliases": [],
      "frontend": "sites/account.xjk.yt/frontend",
      "visibility": "public"
    },
    {
      "id": "learn",
      "name": "Learn",
      "host": "learn.xjk.yt",
      "aliases": [],
      "frontend": "sites/learn.xjk.yt/frontend",
      "visibility": "public"
    },
    {
      "id": "console",
      "name": "Console",
      "host": "console.xjk.yt",
      "aliases": ["bingo.xjk.yt"],
      "frontend": "sites/console.xjk.yt/frontend",
      "visibility": "public"
    },
    {
      "id": "archive",
      "name": "Archive",
      "host": "archive.xjk.yt",
      "aliases": [],
      "frontend": "sites/archive.xjk.yt/frontend",
      "visibility": "public"
    },
    {
      "id": "altered",
      "name": "Altered",
      "host": "altered.xjk.yt",
      "aliases": ["alterednadeo.xjk.yt"],
      "frontend": "sites/altered.xjk.yt/frontend",
      "visibility": "public"
    },
    {
      "id": "trackers",
      "name": "Trackers",
      "host": "trackers.xjk.yt",
      "aliases": ["tracker.xjk.yt", "tracker-displayname.xjk.yt", "tracker-club.xjk.yt"],
      "frontend": "sites/trackers.xjk.yt/frontend",
      "visibility": "public"
    },
    {
      "id": "aggregator",
      "name": "Aggregator",
      "host": "aggregator.xjk.yt",
      "aliases": [],
      "frontend": "sites/aggregator.xjk.yt/frontend",
      "visibility": "public"
    },
    {
      "id": "validifier",
      "name": "Validifier",
      "host": "validifier.xjk.yt",
      "aliases": [],
      "frontend": "sites/validifier.xjk.yt/frontend",
      "visibility": "public"
    },
    {
      "id": "cotd",
      "name": "COTD",
      "host": "cotd.xjk.yt",
      "aliases": [],
      "frontend": "sites/cotd.xjk.yt/frontend",
      "visibility": "public"
    },
    {
      "id": "dash",
      "name": "Dashboard",
      "host": "dash.xjk.yt",
      "aliases": [],
      "frontend": "sites/dash.xjk.yt/frontend",
      "visibility": "private"
    },
    {
      "id": "admin",
      "name": "Admin",
      "host": "admin.xjk.yt",
      "aliases": [],
      "frontend": "sites/admin.xjk.yt/frontend",
      "visibility": "private"
    },
    {
      "id": "plugins",
      "name": "Plugins",
      "host": "plugins.xjk.yt",
      "aliases": [],
      "frontend": "sites/plugins.xjk.yt/Plugins-Hub/frontend",
      "visibility": "public"
    },
    {
      "id": "tools",
      "name": "Tools",
      "host": "tools.xjk.yt",
      "aliases": [],
      "frontend": "sites/tools.xjk.yt/Tools-Hub/frontend",
      "visibility": "public"
    }
  ],
  "services": [
    {
      "id": "validifier-public",
      "processName": "xjk-validifier-public",
      "localName": "validifier-public",
      "cwd": "services/validifier-public",
      "entry": "server.js",
      "runtime": "node",
      "ports": {
        "production": 3044,
        "local": 3144,
        "localParameter": "ValidifierPublicPort",
        "localEnvironmentVariable": "VALIDIFIER_PUBLIC_PORT"
      },
      "health": { "path": "/health", "required": true }
    },
    {
      "id": "cotd-public",
      "processName": "xjk-cotd-public",
      "localName": "cotd-public",
      "cwd": "services/cotd-public",
      "entry": "server.js",
      "runtime": "node",
      "ports": {
        "production": 3045,
        "local": 3145,
        "localParameter": "CotdPublicPort",
        "localEnvironmentVariable": "COTD_PUBLIC_PORT"
      },
      "health": { "path": "/health", "required": true }
    },
    {
      "id": "plugins-hub",
      "processName": "xjk-plugins-hub",
      "localName": "plugins-hub",
      "cwd": "sites/plugins.xjk.yt/Plugins-Hub/backend",
      "entry": "server.js",
      "runtime": "node",
      "ports": {
        "production": 3020,
        "local": 3120,
        "localParameter": "PluginsHubPort",
        "localEnvironmentVariable": "PLUGINS_HUB_PORT"
      },
      "health": { "path": "/health", "required": true }
    },
    {
      "id": "xjk-auth",
      "processName": "xjk-auth",
      "localName": "xjk-auth",
      "cwd": "services/xjk-auth",
      "entry": "server.js",
      "runtime": "node",
      "ports": {
        "production": 3038,
        "local": 3138,
        "localParameter": "XjkAuthPort",
        "localEnvironmentVariable": "XJK_AUTH_PORT"
      },
      "health": { "path": "/health", "required": true }
    },
    {
      "id": "learn-profile",
      "processName": "xjk-learn-profile",
      "localName": "learn-profile",
      "cwd": "services/learn-profile",
      "entry": "server.js",
      "runtime": "node",
      "ports": {
        "production": 3036,
        "local": 3136,
        "localParameter": "LearnProfilePort",
        "localEnvironmentVariable": "LEARN_PROFILE_PORT"
      },
      "health": { "path": "/health", "required": true }
    },
    {
      "id": "console-hub",
      "processName": "xjk-console-hub",
      "localName": "console-hub",
      "cwd": "services/console-hub",
      "entry": "server.js",
      "runtime": "node",
      "ports": {
        "production": 3037,
        "local": 3137,
        "localParameter": "ConsoleHubPort",
        "localEnvironmentVariable": "CONSOLE_HUB_PORT"
      },
      "health": { "path": "/health", "required": true }
    },
    {
      "id": "altered-hub",
      "processName": "xjk-altered-hub",
      "localName": "altered-hub",
      "cwd": "services/altered",
      "entry": "server.js",
      "runtime": "node",
      "ports": {
        "production": 3030,
        "local": 3130,
        "localParameter": "AlteredHubPort",
        "localEnvironmentVariable": "ALTERED_HUB_PORT"
      },
      "health": { "path": "/health", "required": true }
    },
    {
      "id": "bannerbuilder",
      "processName": "xjk-bannerbuilder",
      "localName": "altered-bannerbuilder",
      "cwd": "services/bannerbuilder",
      "entry": "app.py",
      "runtime": "python",
      "ports": {
        "production": 3050,
        "local": 3135,
        "localParameter": "AlteredBannerBuilderPort",
        "localEnvironmentVariable": "ALTERED_BANNER_BUILDER_PORT"
      },
      "health": { "path": "/health", "required": true }
    },
    {
      "id": "tracker-hub",
      "processName": "xjk-tracker-hub",
      "localName": "tracker-hub",
      "cwd": "services/tracker",
      "entry": "server.js",
      "runtime": "node",
      "ports": {
        "production": 3031,
        "local": 3131,
        "localParameter": "TrackerHubPort",
        "localEnvironmentVariable": "TRACKER_HUB_PORT"
      },
      "health": { "path": "/api/v1/tracker/status", "required": true }
    },
    {
      "id": "tracker-leaderboard-hub",
      "processName": "xjk-tracker-leaderboard-hub",
      "localName": "tracker-leaderboard",
      "cwd": "services/tracker",
      "entry": "server.js",
      "runtime": "node",
      "ports": {
        "production": 3043,
        "local": 3143,
        "localParameter": "TrackerLeaderboardHubPort",
        "localEnvironmentVariable": "TRACKER_LEADERBOARD_HUB_PORT"
      },
      "health": { "path": "/health", "required": true }
    },
    {
      "id": "aggregator-hub",
      "processName": "xjk-aggregator-hub",
      "localName": "tracker-aggregator",
      "cwd": "services/aggregator",
      "entry": "server.js",
      "runtime": "node",
      "ports": {
        "production": 3040,
        "local": 3140,
        "localParameter": "AggregatorHubPort",
        "localEnvironmentVariable": "AGGREGATOR_HUB_PORT"
      },
      "health": { "path": "/health", "required": true }
    },
    {
      "id": "tracker-displayname-hub",
      "processName": "xjk-tracker-displayname-hub",
      "localName": "tracker-displayname",
      "cwd": "services/tracker-displayname",
      "entry": "server.js",
      "runtime": "node",
      "ports": {
        "production": 3041,
        "local": 3141,
        "localParameter": "TrackerDisplaynameHubPort",
        "localEnvironmentVariable": "TRACKER_DISPLAYNAME_HUB_PORT"
      },
      "health": { "path": "/health", "required": true }
    },
    {
      "id": "tracker-club-hub",
      "processName": "xjk-tracker-club-hub",
      "localName": "tracker-club",
      "cwd": "services/tracker-club",
      "entry": "server.js",
      "runtime": "node",
      "ports": {